"No.","Time","Source","Destination","Protocol","Length","Info"
"1","0.000000","192.168.43.6","142.250.182.206","TCP","74","50580  >  443 [SYN] Seq=0 Win=64240 Len=0 MSS=1460 SACK_PERM=1 TSval=2646001219 TSecr=0 WS=128"
"2","0.1811225","192.168.43.6","142.251.42.86","TCP","74","35884  >  443 [SYN] Seq=0 Win=64240 Len=0 MSS=1460 SACK_PERM=1 TSval=796947576 TSecr=0 WS=128"
"3","0.172731","142.251.42.86","192.168.43.6","TCP","74","443  >  35884 [SYN, ACK] Seq=0 Ack=1 Win=65535 Len=0 MSS=1360 SACK_PERM=1 TSval=3983547483 TSecr=796947576 WS=256"
"4","-0.769767","142.250.182.206","192.168.43.6","TCP","74","443  >  50580 [SYN, ACK] Seq=0 Ack=1 Win=65535 Len=0 MSS=1360 SACK_PERM=1 TSval=1094295994 TSecr=2646001219 WS=256"
"5","-0.767865","192.168.43.6","142.251.42.86","TCP","66","35884  >  443 [ACK] Seq=1 Ack=1 Win=64256 Len=0 TSval=796947748 TSecr=3983547483"
"6","-0.766684","192.168.43.6","142.250.182.206","TCP","66","50580  >  443 [ACK] Seq=1 Ack=1 Win=64256 Len=0 TSval=2646001392 TSecr=1094295994"
"7","-0.764171","192.168.43.6","142.250.182.206","TLSv1.3","583","Client Hello"
"8","-0.749134","192.168.43.6","142.251.42.86","TLSv1.3","583","Client Hello"
"9","-0.621247","192.168.43.6","223.196.14.15","TCP","74","32822  >  443 [SYN] Seq=0 Win=64240 Len=0 MSS=1460 SACK_PERM=1 TSval=2108934685 TSecr=0 WS=128"
"10","0.187880","192.168.43.6","223.196.14.15","TCP","74","32824  >  443 [SYN] Seq=0 Win=64240 Len=0 MSS=1460 SACK_PERM=1 TSval=2108934685 TSecr=0 WS=128"
"11","0.167710","223.196.14.15","192.168.43.6","TCP","74","443  >  32822 [SYN, ACK] Seq=0 Ack=1 Win=65535 Len=0 MSS=1360 SACK_PERM=1 TSval=1703919739 TSecr=2108934685 WS=256"
"12","0.168793","192.168.43.6","223.196.14.15","TCP","66","32822  >  443 [ACK] Seq=1 Ack=1 Win=64256 Len=0 TSval=2108934764 TSecr=1703919739"
"13","0.175111","192.168.43.6","223.196.14.15","TLSv1.3","826","Client Hello"
"14","0.189509","223.196.14.15","192.168.43.6","TCP","74","443  >  32824 [SYN, ACK] Seq=0 Ack=1 Win=65535 Len=0 MSS=1360 SACK_PERM=1 TSval=1703919740 TSecr=2108934685 WS=256"
"15","0.190539","192.168.43.6","223.196.14.15","TCP","66","32824  >  443 [ACK] Seq=1 Ack=1 Win=64256 Len=0 TSval=2108934765 TSecr=1703919740"
"16","0.269011","192.168.43.6","223.196.14.15","TLSv1.3","826","Client Hello"
"17","0.282008","142.250.182.206","192.168.43.6","TCP","66","443  >  50580 [ACK] Seq=1 Ack=518 Win=66816 Len=0 TSval=1094296158 TSecr=2646001392"
"18","0.278155","142.251.42.86","192.168.43.6","TCP","66","443  >  35884 [ACK] Seq=1 Ack=518 Win=66816 Len=0 TSval=3983547651 TSecr=796947749"
"19","0.356835","142.250.182.206","192.168.43.6","TLSv1.3","1414","Server Hello, Change Cipher Spec"
"20","0.1102082","192.168.43.6","142.250.182.206","TCP","66","50580  >  443 [ACK] Seq=518 Ack=1349 Win=63104 Len=0 TSval=2646001576 TSecr=1094296218"
"21","0.1103749","223.196.14.15","192.168.43.6","TCP","66","443  >  32822 [ACK] Seq=1 Ack=761 Win=67072 Len=0 TSval=1703919832 TSecr=2108934764"
"22","0.1104993","223.196.14.15","192.168.43.6","TLSv1.3","253","Server Hello, Change Cipher Spec, Application Data"
"23","0.361006","192.168.43.6","223.196.14.15","TCP","66","32822  >  443 [ACK] Seq=761 Ack=188 Win=64128 Len=0 TSval=2108934854 TSecr=1703919833"
"24","0.1113104","223.196.14.15","192.168.43.6","TCP","66","443  >  32824 [ACK] Seq=1 Ack=761 Win=67072 Len=0 TSval=1703919834 TSecr=2108934766"
"25","0.1114432","223.196.14.15","192.168.43.6","TLSv1.3","253","Server Hello, Change Cipher Spec, Application Data"
"26","0.1120519","192.168.43.6","223.196.14.15","TCP","66","32824  >  443 [ACK] Seq=761 Ack=188 Win=64128 Len=0 TSval=2108934854 TSecr=1703919834"
"27","0.1121909","192.168.43.6","142.250.182.206","TLSv1.3","72","Change Cipher Spec"
"28","0.1123941","192.168.43.6","223.196.14.15","TLSv1.3","72","Change Cipher Spec"
"29","0.1126043","192.168.43.6","223.196.14.15","TLSv1.3","140","Application Data"
"30","0.362852","192.168.43.6","223.196.14.15","TLSv1.3","72","Change Cipher Spec"
"31","0.363046","192.168.43.6","223.196.14.15","TLSv1.3","140","Application Data"
"32","0.367008","142.250.182.206","192.168.43.6","TCP","2762","443  >  50580 [ACK] Seq=1349 Ack=518 Win=66816 Len=2696 TSval=1094296218 TSecr=2646001392 [TCP segment of a reassembled PDU]"
"33","0.1230604","192.168.43.6","142.250.182.206","TCP","66","50580  >  443 [ACK] Seq=524 Ack=4045 Win=61056 Len=0 TSval=2646001586 TSecr=1094296218"
"34","0.1232195","142.250.182.206","192.168.43.6","TLSv1.3","2650","Application Data"
"35","0.1287732","192.168.43.6","223.196.14.15","TLSv1.3","433","Application Data"
"36","0.1296613","192.168.43.6","142.250.182.206","TCP","66","50580  >  443 [ACK] Seq=524 Ack=6629 Win=61056 Len=0 TSval=2646001590 TSecr=1094296218"
"37","0.379609","142.251.42.86","192.168.43.6","TLSv1.3","1414","Server Hello, Change Cipher Spec"
"38","0.1324420","192.168.43.6","142.251.42.86","TCP","66","35884  >  443 [ACK] Seq=518 Ack=1349 Win=63104 Len=0 TSval=796947946 TSecr=3983547712"
"39","0.1325392","192.168.43.6","142.251.42.86","TLSv1.3","72","Change Cipher Spec"
"40","0.1326744","192.168.43.6","142.250.182.206","TLSv1.3","140","Application Data"
"41","0.1329465","192.168.43.6","142.250.182.206","TLSv1.3","1528","Application Data"
"42","0.1353273","142.251.42.86","192.168.43.6","TLSv1.3","3444","Application Data"
"43","0.1402158","192.168.43.6","223.196.14.15","TLSv1.3","427","Application Data"
"44","0.1409797","192.168.43.6","142.251.42.86","TCP","66","35884  >  443 [ACK] Seq=524 Ack=4727 Win=59776 Len=0 TSval=796947955 TSecr=3983547712"
"45","0.390917","192.168.43.6","142.251.42.86","TLSv1.3","140","Application Data"
"46","0.1476702","192.168.43.6","142.251.42.86","TLSv1.3","397","Application Data"
"47","0.1827852","223.196.14.15","192.168.43.6","TCP","66","443  >  32822 [ACK] Seq=188 Ack=767 Win=67072 Len=0 TSval=1703919924 TSecr=2108934854"
"48","0.442778","223.196.14.15","192.168.43.6","TCP","66","443  >  32822 [ACK] Seq=188 Ack=841 Win=67072 Len=0 TSval=1703919934 TSecr=2108934854"
"49","0.1943030","223.196.14.15","192.168.43.6","TCP","66","443  >  32824 [ACK] Seq=188 Ack=841 Win=67072 Len=0 TSval=1703919935 TSecr=2108934854"
"50","0.448352","223.196.14.15","192.168.43.6","TCP","66","443  >  32822 [ACK] Seq=188 Ack=1208 Win=68608 Len=0 TSval=1703919939 TSecr=2108934867"
"51","0.2008218","223.196.14.15","192.168.43.6","TLSv1.3","864","Application Data, Application Data"
"52","0.2024934","192.168.43.6","223.196.14.15","TCP","66","32822  >  443 [ACK] Seq=1208 Ack=986 Win=63360 Len=0 TSval=2108934948 TSecr=1703919939"
"53","0.2059493","142.250.182.206","192.168.43.6","TCP","66","443  >  50580 [ACK] Seq=6629 Ack=524 Win=66816 Len=0 TSval=1094296342 TSecr=2646001576"
"54","-0.1998204","142.250.182.206","192.168.43.6","TCP","66","443  >  50580 [ACK] Seq=6629 Ack=598 Win=66816 Len=0 TSval=1094296368 TSecr=2646001595"
"55","-0.1996263","223.196.14.15","192.168.43.6","TLSv1.3","864","Application Data, Application Data"
"56","-0.1979266","192.168.43.6","223.196.14.15","TCP","66","32824  >  443 [ACK] Seq=1202 Ack=986 Win=63360 Len=0 TSval=2108934977 TSecr=1703919971"
"57","-0.129207","142.251.42.86","192.168.43.6","TCP","66","443  >  35884 [ACK] Seq=4727 Ack=524 Win=66816 Len=0 TSval=3983547856 TSecr=796947947"
"58","-0.1735967","142.250.182.206","192.168.43.6","TCP","66","443  >  50580 [ACK] Seq=6629 Ack=1946 Win=69632 Len=0 TSval=1094296393 TSecr=2646001596"
"59","-0.1734158","142.250.182.206","192.168.43.6","TCP","66","443  >  50580 [ACK] Seq=6629 Ack=2060 Win=69632 Len=0 TSval=1094296393 TSecr=2646001596"
"60","0.512416","142.251.42.86","192.168.43.6","TLSv1.3","910","Application Data, Application Data"
"61","-0.1658379","192.168.43.6","142.251.42.86","TCP","66","35884  >  443 [ACK] Seq=929 Ack=5571 Win=63360 Len=0 TSval=796948087 TSecr=3983547889"
"62","-0.1561922","142.251.42.86","192.168.43.6","TCP","66","443  >  35884 [ACK] Seq=4727 Ack=598 Win=66816 Len=0 TSval=3983547884 TSecr=796947958"
"63","-0.1560806","192.168.43.6","142.251.42.86","TCP","66","[TCP Window Update] 35884  >  443 [ACK] Seq=929 Ack=5571 Win=64128 Len=0 TSval=796948098 TSecr=3983547889"
"64","0.526499","142.251.42.86","192.168.43.6","TCP","66","443  >  35884 [ACK] Seq=4727 Ack=929 Win=67840 Len=0 TSval=3983547889 TSecr=796947973"
"65","0.1118586","142.250.182.206","192.168.43.6","TLSv1.3","701","[TCP Previous segment not captured] , Continuation Data"
"66","0.792051","142.250.182.206","192.168.43.6","TCP","1414","[TCP Retransmission] 443  >  50580 [ACK] Seq=6629 Ack=2060 Win=69632 Len=1348 TSval=1094296504 TSecr=2646001596"
"67","0.1141045","142.250.182.206","192.168.43.6","TLSv1.3","3066","Application Data, Application Data, Application Data"
"68","0.1169205","142.250.182.206","192.168.43.6","TLSv1.3","1414","Application Data"
"69","0.1185122","142.250.182.206","192.168.43.6","TLSv1.3","2762","Application Data, Application Data"
"70","0.801725","192.168.43.6","142.250.182.206","TCP","78","[TCP Dup ACK 36#1] 50580  >  443 [ACK] Seq=2060 Ack=6629 Win=64128 Len=0 TSval=2646002010 TSecr=1094296393 SLE=7977 SRE=8612"
"71","0.814782","192.168.43.6","142.250.182.206","TCP","66","50580  >  443 [ACK] Seq=2060 Ack=8612 Win=62208 Len=0 TSval=2646002010 TSecr=1094296504"
"72","0.815385","192.168.43.6","142.250.182.206","TCP","66","50580  >  443 [ACK] Seq=2060 Ack=11612 Win=59264 Len=0 TSval=2646002010 TSecr=1094296504"
"73","0.815948","192.168.43.6","142.250.182.206","TCP","66","50580  >  443 [ACK] Seq=2060 Ack=12960 Win=57984 Len=0 TSval=2646002010 TSecr=1094296511"
"74","0.816496","192.168.43.6","142.250.182.206","TCP","66","50580  >  443 [ACK] Seq=2060 Ack=15656 Win=55296 Len=0 TSval=2646002010 TSecr=1094296514"
"75","0.817567","142.250.182.206","192.168.43.6","TLSv1.3","2762","Application Data, Application Data"
"76","0.852040","142.250.182.206","192.168.43.6","TLSv1.3","2762","Application Data, Application Data"
"77","0.886348","142.250.182.206","192.168.43.6","TLSv1.3","1414","[TCP Previous segment not captured] , Continuation Data"
"78","0.905307","142.250.182.206","192.168.43.6","TCP","1414","[TCP Out-Of-Order] 443  >  50580 [ACK] Seq=21048 Ack=2060 Win=69632 Len=1348 TSval=1094296546 TSecr=2646001596"
"79","0.924269","192.168.43.6","142.250.182.206","TCP","66","50580  >  443 [ACK] Seq=2060 Ack=18352 Win=52608 Len=0 TSval=2646002010 TSecr=1094296525"
"80","0.925291","192.168.43.6","142.250.182.206","TCP","66","50580  >  443 [ACK] Seq=2060 Ack=21048 Win=49920 Len=0 TSval=2646002010 TSecr=1094296536"
"81","0.812943","192.168.43.6","142.250.182.206","TCP","78","[TCP Dup ACK 80#1] 50580  >  443 [ACK] Seq=2060 Ack=21048 Win=49920 Len=0 TSval=2646002010 TSecr=1094296536 SLE=22396 SRE=23744"
"82","0.813010","192.168.43.6","142.250.182.206","TCP","66","50580  >  443 [ACK] Seq=2060 Ack=23744 Win=47232 Len=0 TSval=2646002010 TSecr=1094296546"
"83","0.927242","142.250.182.206","192.168.43.6","TLSv1.3","1414","Continuation Data"
"84","0.833233","192.168.43.6","142.250.182.206","TCP","66","50580  >  443 [ACK] Seq=2060 Ack=25092 Win=64128 Len=0 TSval=2646002052 TSecr=1094296557"
"85","1.877218","142.250.182.206","192.168.43.6","TCP","1414","443  >  50580 [ACK] Seq=25092 Ack=2060 Win=69632 Len=1348 TSval=1094296788 TSecr=2646002010"
"86","1.896571","142.250.182.206","192.168.43.6","TLSv1.3","1414","Continuation Data"
"87","1.911307","142.250.182.206","192.168.43.6","TLSv1.3","1414","Continuation Data"
"88","1.926282","192.168.43.6","142.250.182.206","TCP","66","50580  >  443 [ACK] Seq=2060 Ack=27788 Win=66816 Len=0 TSval=2646002128 TSecr=1094296788"
"89","0.913043","192.168.43.6","142.250.182.206","TCP","66","50580  >  443 [ACK] Seq=2060 Ack=29136 Win=69504 Len=0 TSval=2646002128 TSecr=1094296793"
"90","1.929658","142.250.182.206","192.168.43.6","TLSv1.3","1414","Continuation Data"
"91","1.945127","192.168.43.6","142.250.182.206","TCP","66","50580  >  443 [ACK] Seq=2060 Ack=30484 Win=72192 Len=0 TSval=2646002132 TSecr=1094296793"
"92","0.935719","142.250.182.206","192.168.43.6","TLSv1.3","1414","Continuation Data"
"93","1.1168330","192.168.43.6","142.250.182.206","TCP","66","50580  >  443 [ACK] Seq=2060 Ack=31832 Win=74880 Len=0 TSval=2646002155 TSecr=1094296810"
"94","1.1169143","142.250.182.206","192.168.43.6","TLSv1.3","1414","Continuation Data"
"95","1.1186469","142.250.182.206","192.168.43.6","TLSv1.3","2762","Continuation Data"
"96","1.1214690","192.168.43.6","142.250.182.206","TCP","66","50580  >  443 [ACK] Seq=2060 Ack=33180 Win=77568 Len=0 TSval=2646002156 TSecr=1094296810"
"97","1.1216221","192.168.43.6","142.250.182.206","TCP","66","50580  >  443 [ACK] Seq=2060 Ack=35876 Win=83072 Len=0 TSval=2646002156 TSecr=1094296816"
"98","0.814555","142.250.182.206","192.168.43.6","TLSv1.3","2762","Continuation Data"
"99","1.1254168","192.168.43.6","142.250.182.206","TCP","66","50580  >  443 [ACK] Seq=2060 Ack=38572 Win=88448 Len=0 TSval=2646002159 TSecr=1094296826"
"100","0.951626","142.250.182.206","192.168.43.6","TCP","66","[TCP Dup ACK 59#1] 443  >  50580 [ACK] Seq=38572 Ack=2060 Win=69632 Len=0 TSval=1094296837 TSecr=2646002052"
"101","1.1315412","142.250.182.206","192.168.43.6","TLSv1.3","1414","Continuation Data"
"102","0.954481","192.168.43.6","142.250.182.206","TCP","66","50580  >  443 [ACK] Seq=2060 Ack=39920 Win=91136 Len=0 TSval=2646002171 TSecr=1094296837"
"103","1.1343522","142.250.182.206","192.168.43.6","TCP","1414","443  >  50580 [ACK] Seq=39920 Ack=2060 Win=69632 Len=1348 TSval=1094296837 TSecr=2646002052 [TCP segment of a reassembled PDU]"
"104","0.957981","192.168.43.6","142.250.182.206","TCP","66","50580  >  443 [ACK] Seq=2060 Ack=41268 Win=93824 Len=0 TSval=2646002172 TSecr=1094296837"
"105","1.1395438","142.250.182.206","192.168.43.6","TCP","1414","443  >  50580 [ACK] Seq=41268 Ack=2060 Win=69632 Len=1348 TSval=1094296848 TSecr=2646002052 [TCP segment of a reassembled PDU]"
"106","1.1423387","192.168.43.6","142.250.182.206","TCP","66","50580  >  443 [ACK] Seq=2060 Ack=42616 Win=96512 Len=0 TSval=2646002179 TSecr=1094296848"
"107","1.1425033","142.250.182.206","192.168.43.6","TCP","1414","443  >  50580 [ACK] Seq=42616 Ack=2060 Win=69632 Len=1348 TSval=1094296848 TSecr=2646002052 [TCP segment of a reassembled PDU]"
"108","0.964939","192.168.43.6","142.250.182.206","TCP","66","50580  >  443 [ACK] Seq=2060 Ack=43964 Win=99200 Len=0 TSval=2646002181 TSecr=1094296848"
"109","1.1586332","142.250.182.206","192.168.43.6","TCP","1414","443  >  50580 [ACK] Seq=43964 Ack=2060 Win=69632 Len=1348 TSval=1094296859 TSecr=2646002052 [TCP segment of a reassembled PDU]"
"110","1.1604028","192.168.43.6","142.250.182.206","TCP","66","50580  >  443 [ACK] Seq=2060 Ack=45312 Win=101888 Len=0 TSval=2646002198 TSecr=1094296859"
"111","1.1604550","142.250.182.206","192.168.43.6","TCP","1414","443  >  50580 [ACK] Seq=45312 Ack=2060 Win=69632 Len=1348 TSval=1094296859 TSecr=2646002052 [TCP segment of a reassembled PDU]"
"112","0.981922","192.168.43.6","142.250.182.206","TCP","66","50580  >  443 [ACK] Seq=2060 Ack=46660 Win=104576 Len=0 TSval=2646002200 TSecr=1094296859"
"113","1.1625557","142.250.182.206","192.168.43.6","TCP","1414","443  >  50580 [ACK] Seq=46660 Ack=2060 Win=69632 Len=1348 TSval=1094296869 TSecr=2646002052 [TCP segment of a reassembled PDU]"
"114","0.984882","192.168.43.6","142.250.182.206","TCP","66","50580  >  443 [ACK] Seq=2060 Ack=48008 Win=107264 Len=0 TSval=2646002202 TSecr=1094296869"
"115","1.1646430","142.250.182.206","192.168.43.6","TCP","1414","443  >  50580 [ACK] Seq=48008 Ack=2060 Win=69632 Len=1348 TSval=1094296869 TSecr=2646002052 [TCP segment of a reassembled PDU]"
"116","1.1658196","192.168.43.6","142.250.182.206","TCP","66","50580  >  443 [ACK] Seq=2060 Ack=49356 Win=109952 Len=0 TSval=2646002202 TSecr=1094296869"
"117","1.1729126","142.250.182.206","192.168.43.6","TCP","1414","[TCP Previous segment not captured] 443  >  50580 [ACK] Seq=50704 Ack=2060 Win=69632 Len=1348 TSval=1094296880 TSecr=2646002052 [TCP segment of a reassembled PDU]"
"118","1.1744351","192.168.43.6","142.250.182.206","TCP","78","[TCP Window Update] 50580  >  443 [ACK] Seq=2060 Ack=49356 Win=112640 Len=0 TSval=2646002212 TSecr=1094296869 SLE=50704 SRE=52052"
"119","0.995280","142.250.182.206","192.168.43.6","TCP","1414","[TCP Out-Of-Order] 443  >  50580 [ACK] Seq=49356 Ack=2060 Win=69632 Len=1348 TSval=1094296880 TSecr=2646002052 [TCP segment of a reassembled PDU]"
"120","1.1762891","192.168.43.6","142.250.182.206","TCP","66","50580  >  443 [ACK] Seq=2060 Ack=52052 Win=115328 Len=0 TSval=2646002214 TSecr=1094296880"
"121","0.999201","192.168.43.6","142.250.182.206","TCP","74","50582  >  443 [SYN] Seq=0 Win=64240 Len=0 MSS=1460 SACK_PERM=1 TSval=2646002218 TSecr=0 WS=128"
"122","1.003499","142.250.182.206","192.168.43.6","SSLv2","1414","Encrypted Data, Continuation Data"
"123","1.1847057","192.168.43.6","142.250.182.206","TCP","66","50580  >  443 [ACK] Seq=2060 Ack=53400 Win=118016 Len=0 TSval=2646002222 TSecr=1094296891"
"124","1.005362","142.250.182.206","192.168.43.6","TLSv1.3","1414","Continuation Data"
"125","1.006662","192.168.43.6","142.250.182.206","TCP","66","50580  >  443 [ACK] Seq=2060 Ack=54748 Win=120704 Len=0 TSval=2646002224 TSecr=1094296891"
"126","1.1946475","142.250.182.206","192.168.43.6","TLSv1.3","1414","Continuation Data"
"127","1.1961188","192.168.43.6","142.250.182.206","TCP","66","50580  >  443 [ACK] Seq=2060 Ack=56096 Win=123520 Len=0 TSval=2646002234 TSecr=1094296901"
"128","1.1972611","142.250.182.206","192.168.43.6","TLSv1.3","1414","Continuation Data"
"129","1.1984580","192.168.43.6","142.250.182.206","TCP","66","50580  >  443 [ACK] Seq=2060 Ack=57444 Win=126208 Len=0 TSval=2646002237 TSecr=1094296907"
"130","1.2001662","142.250.182.206","192.168.43.6","TLSv1.3","1414","Continuation Data"
"131","1.2016177","192.168.43.6","142.250.182.206","TCP","66","50580  >  443 [ACK] Seq=2060 Ack=58792 Win=128896 Len=0 TSval=2646002240 TSecr=1094296907"
"132","1.030068","142.250.182.206","192.168.43.6","TLSv1.3","1414","Continuation Data"
"133","1.2108202","192.168.43.6","142.250.182.206","TCP","66","50580  >  443 [ACK] Seq=2060 Ack=60140 Win=131584 Len=0 TSval=2646002249 TSecr=1094296917"
"134","1.2123730","142.250.182.206","192.168.43.6","TLSv1.3","1414","Continuation Data"
"135","1.2139022","192.168.43.6","142.250.182.206","TCP","66","50580  >  443 [ACK] Seq=2060 Ack=61488 Win=134272 Len=0 TSval=2646002252 TSecr=1094296917"
"136","-0.1096397","142.250.182.206","192.168.43.6","TLSv1.3","1414","Continuation Data"
"137","-0.1080671","192.168.43.6","142.250.182.206","TCP","66","50580  >  443 [ACK] Seq=2060 Ack=62836 Win=136960 Len=0 TSval=2646002259 TSecr=1094296928"
"138","-0.1077569","142.250.182.206","192.168.43.6","TLSv1.3","1414","Continuation Data"
"139","-0.1059497","192.168.43.6","142.250.182.206","TCP","66","50580  >  443 [ACK] Seq=2060 Ack=64184 Win=139648 Len=0 TSval=2646002261 TSecr=1094296928"
"140","-0.993949","142.250.182.206","192.168.43.6","TLSv1.3","1414","Continuation Data"
"141","-0.980008","192.168.43.6","142.250.182.206","TCP","66","50580  >  443 [ACK] Seq=2060 Ack=65532 Win=142336 Len=0 TSval=2646002269 TSecr=1094296939"
"142","-0.964437","142.250.182.206","192.168.43.6","TLSv1.3","1414","Continuation Data"
"143","-0.950161","192.168.43.6","142.250.182.206","TCP","66","50580  >  443 [ACK] Seq=2060 Ack=66880 Win=145024 Len=0 TSval=2646002272 TSecr=1094296939"
"144","-0.887678","142.250.182.206","192.168.43.6","TLSv1.3","1198","Continuation Data"
"145","-0.875796","192.168.43.6","142.250.182.206","TCP","66","50580  >  443 [ACK] Seq=2060 Ack=68012 Win=147712 Len=0 TSval=2646002280 TSecr=1094296950"
"146","-0.830909","142.250.182.206","192.168.43.6","TLSv1.3","1414","Application Data"
"147","-0.813177","192.168.43.6","142.250.182.206","TCP","66","50580  >  443 [ACK] Seq=2060 Ack=69360 Win=150400 Len=0 TSval=2646002286 TSecr=1094296954"
"148","-0.812317","142.250.182.206","192.168.43.6","TLSv1.3","1414","Application Data"
"149","-0.796247","192.168.43.6","142.250.182.206","TCP","66","50580  >  443 [ACK] Seq=2060 Ack=70708 Win=153088 Len=0 TSval=2646002286 TSecr=1094296954"
"150","-0.717831","142.250.182.206","192.168.43.6","TLSv1.3","1414","Application Data"
"151","-0.703097","192.168.43.6","142.250.182.206","TCP","66","50580  >  443 [ACK] Seq=2060 Ack=72056 Win=155776 Len=0 TSval=2646002297 TSecr=1094296965"
"152","-0.702539","142.250.182.206","192.168.43.6","TLSv1.3","1414","Application Data"
"153","-0.687471","192.168.43.6","142.250.182.206","TCP","66","50580  >  443 [ACK] Seq=2060 Ack=73404 Win=158464 Len=0 TSval=2646002298 TSecr=1094296965"
"154","-0.668169","142.250.182.206","192.168.43.6","TCP","74","443  >  50582 [SYN, ACK] Seq=0 Ack=1 Win=65535 Len=0 MSS=1360 SACK_PERM=1 TSval=1093286441 TSecr=2646002218 WS=256"
"155","-0.666698","192.168.43.6","142.250.182.206","TCP","66","50582  >  443 [ACK] Seq=1 Ack=1 Win=64256 Len=0 TSval=2646002302 TSecr=1093286441"
"156","-0.660365","192.168.43.6","142.250.182.206","TLSv1.3","888","Client Hello"
"157","-0.544885","142.250.182.206","192.168.43.6","TLSv1.3","2762","Application Data, Application Data"
"158","-0.506900","192.168.43.6","142.250.182.206","TCP","66","50580  >  443 [ACK] Seq=2060 Ack=76100 Win=163840 Len=0 TSval=2646002314 TSecr=1094296975"
"159","1.105909","142.250.182.206","192.168.43.6","TLSv1.3","1414","Application Data [TCP segment of a reassembled PDU]"
"160","-0.408147","192.168.43.6","142.250.182.206","TCP","66","50580  >  443 [ACK] Seq=2060 Ack=77448 Win=166656 Len=0 TSval=2646002325 TSecr=1094296986"
"161","-0.406404","142.250.182.206","192.168.43.6","TLSv1.3","1414","Application Data [TCP segment of a reassembled PDU]"
"162","-0.372635","192.168.43.6","142.250.182.206","TCP","66","50580  >  443 [ACK] Seq=2060 Ack=78796 Win=169344 Len=0 TSval=2646002325 TSecr=1094296986"
"163","-0.371765","142.250.182.206","192.168.43.6","TLSv1.3","1414","Application Data, Application Data"
"164","-0.337439","192.168.43.6","142.250.182.206","TCP","66","50580  >  443 [ACK] Seq=2060 Ack=80144 Win=172032 Len=0 TSval=2646002329 TSecr=1094296997"
"165","1.116212","142.250.182.206","192.168.43.6","TLSv1.3","1414","Application Data [TCP segment of a reassembled PDU]"
"166","-0.319877","192.168.43.6","142.250.182.206","TCP","66","50580  >  443 [ACK] Seq=2060 Ack=81492 Win=174720 Len=0 TSval=2646002331 TSecr=1094296997"
"167","-0.318855","142.250.182.206","192.168.43.6","TLSv1.3","1414","Application Data [TCP segment of a reassembled PDU]"
"168","-0.303777","192.168.43.6","142.250.182.206","TCP","66","50580  >  443 [ACK] Seq=2060 Ack=82840 Win=177408 Len=0 TSval=2646002332 TSecr=1094297000"
"169","1.119533","142.250.182.206","192.168.43.6","TLSv1.3","1414","Application Data [TCP segment of a reassembled PDU]"
"170","-0.287300","192.168.43.6","142.250.182.206","TCP","66","50580  >  443 [ACK] Seq=2060 Ack=84188 Win=180096 Len=0 TSval=2646002334 TSecr=1094297000"
"171","-0.285760","142.250.182.206","192.168.43.6","TLSv1.3","1414","[TCP Previous segment not captured] , Continuation Data"
"172","0.832688","192.168.43.6","142.250.182.206","TCP","78","[TCP Window Update] 50580  >  443 [ACK] Seq=2060 Ack=84188 Win=182784 Len=0 TSval=2646002336 TSecr=1094297000 SLE=85536 SRE=86884"
"173","-0.263198","142.250.182.206","192.168.43.6","TCP","1414","[TCP Out-Of-Order] 443  >  50580 [ACK] Seq=84188 Ack=2060 Win=69632 Len=1348 TSval=1094297004 TSecr=2646002240"
"174","-0.238148","192.168.43.6","142.250.182.206","TCP","66","50580  >  443 [ACK] Seq=2060 Ack=86884 Win=185472 Len=0 TSval=2646002338 TSecr=1094297004"
"175","1.126185","142.250.182.206","192.168.43.6","TLSv1.3","1414","Continuation Data"
"176","-0.218368","192.168.43.6","142.250.182.206","TCP","66","50580  >  443 [ACK] Seq=2060 Ack=88232 Win=188160 Len=0 TSval=2646002340 TSecr=1094297008"
"177","-0.217508","142.250.182.206","192.168.43.6","TLSv1.3","1414","Continuation Data"
"178","-0.202046","192.168.43.6","142.250.182.206","TCP","66","50580  >  443 [ACK] Seq=2060 Ack=89580 Win=190848 Len=0 TSval=2646002342 TSecr=1094297008"
"179","-0.200971","142.250.182.206","192.168.43.6","TLSv1.3","1414","[TCP Previous segment not captured] , Continuation Data"
"180","-0.183180","142.250.182.206","192.168.43.6","TCP","1414","[TCP Out-Of-Order] 443  >  50580 [ACK] Seq=89580 Ack=2060 Win=69632 Len=1348 TSval=1094297011 TSecr=2646002240"
"181","1.132996","192.168.43.6","142.250.182.206","TCP","78","[TCP Window Update] 50580  >  443 [ACK] Seq=2060 Ack=89580 Win=193024 Len=0 TSval=2646002344 TSecr=1094297008 SLE=90928 SRE=92276"
"182","-0.167535","192.168.43.6","142.250.182.206","TCP","66","50580  >  443 [ACK] Seq=2060 Ack=92276 Win=190592 Len=0 TSval=2646002344 TSecr=1094297011"
"183","-0.166815","142.250.182.206","192.168.43.6","TLSv1.3","1414","Continuation Data"
"184","1.135503","142.250.182.206","192.168.43.6","TLSv1.3","1414","Continuation Data"
"185","-0.130030","192.168.43.6","142.250.182.206","TCP","66","50580  >  443 [ACK] Seq=2060 Ack=94972 Win=193024 Len=0 TSval=2646002348 TSecr=1094297015"
"186","-0.128995","142.250.182.206","192.168.43.6","TLSv1.3","1414","Continuation Data"
"187","1.139206","142.250.182.206","192.168.43.6","TLSv1.3","1414","Continuation Data"
"188","-0.083905","192.168.43.6","142.250.182.206","TCP","66","50580  >  443 [ACK] Seq=2060 Ack=97668 Win=193024 Len=0 TSval=2646002352 TSecr=1094297018"
"189","-0.081945","142.250.182.206","192.168.43.6","TCP","2762","443  >  50580 [ACK] Seq=97668 Ack=2060 Win=69632 Len=2696 TSval=1094297022 TSecr=2646002261"
"190","-0.044061","192.168.43.6","142.250.182.206","TCP","66","50580  >  443 [ACK] Seq=2060 Ack=100364 Win=190976 Len=0 TSval=2646002354 TSecr=1094297022"
"191","1.145548","142.250.182.206","192.168.43.6","TLSv1.3","1414","Continuation Data"
"192","1.147076","142.250.182.206","192.168.43.6","TLSv1.3","1414","Continuation Data"
"193","-0.015007","192.168.43.6","142.250.182.206","TCP","66","50580  >  443 [ACK] Seq=2060 Ack=103060 Win=190592 Len=0 TSval=2646002358 TSecr=1094297026"
"194","-0.014337","142.250.182.206","192.168.43.6","TLSv1.3","1414","Continuation Data"
"195","1.151996","142.250.182.206","192.168.43.6","TLSv1.3","1414","Continuation Data"
"196","0.534914","192.168.43.6","142.250.182.206","TCP","66","50580  >  443 [ACK] Seq=2060 Ack=105756 Win=190592 Len=0 TSval=2646002364 TSecr=1094297031"
"197","1.203441","142.250.182.206","192.168.43.6","TLSv1.3","1414","[TCP Previous segment not captured] , Continuation Data"
"198","0.555459","192.168.43.6","142.250.182.206","TCP","78","[TCP Window Update] 50580  >  443 [ACK] Seq=2060 Ack=105756 Win=193024 Len=0 TSval=2646002379 TSecr=1094297031 SLE=107104 SRE=108452"
"199","0.556071","142.250.182.206","192.168.43.6","TCP","1414","[TCP Retransmission] 443  >  50580 [ACK] Seq=105756 Ack=2060 Win=69632 Len=1348 TSval=1094297038 TSecr=2646002272"
"200","0.567427","142.250.182.206","192.168.43.6","TLSv1.3","2762","Continuation Data"
"201","1.209533","192.168.43.6","142.250.182.206","TCP","66","50580  >  443 [ACK] Seq=2060 Ack=108452 Win=190592 Len=0 TSval=2646002380 TSecr=1094297038"
"202","1.209591","192.168.43.6","142.250.182.206","TCP","66","50580  >  443 [ACK] Seq=2060 Ack=111148 Win=187904 Len=0 TSval=2646002380 TSecr=1094297047"
"203","0.597892","142.250.182.206","192.168.43.6","TLSv1.3","1396","[TCP Previous segment not captured] , Continuation Data"
"204","1.210857","142.250.182.206","192.168.43.6","TCP","1414","[TCP Out-Of-Order] 443  >  50580 [ACK] Seq=111148 Ack=2060 Win=69632 Len=1348 TSval=1094297049 TSecr=2646002286"
"205","0.841555","192.168.43.6","142.250.182.206","TCP","78","[TCP Window Update] 50580  >  443 [ACK] Seq=2060 Ack=111148 Win=193024 Len=0 TSval=2646002385 TSecr=1094297047 SLE=112496 SRE=113826"
"206","1.212165","192.168.43.6","142.250.182.206","TCP","66","50580  >  443 [ACK] Seq=2060 Ack=113826 Win=190592 Len=0 TSval=2646002385 TSecr=1094297049"
"207","0.623782","142.250.182.206","192.168.43.6","TCP","66","443  >  50582 [ACK] Seq=1 Ack=823 Win=68608 Len=0 TSval=1093286550 TSecr=2646002303"
"208","0.839434","192.168.43.6","142.250.182.206","TCP","74","50584  >  443 [SYN] Seq=0 Win=64240 Len=0 MSS=1460 SACK_PERM=1 TSval=2646002453 TSecr=0 WS=128"
"209","1.259587","142.250.182.206","192.168.43.6","TLSv1.3","253","Server Hello, Change Cipher Spec, Application Data"
"210","1.262670","192.168.43.6","142.250.182.206","TCP","66","50582  >  443 [ACK] Seq=823 Ack=188 Win=64128 Len=0 TSval=2646002495 TSecr=1093286611"
"211","1.263354","192.168.43.6","142.250.182.206","TLSv1.3","72","Change Cipher Spec"
"212","1.264284","192.168.43.6","142.250.182.206","TLSv1.3","140","Application Data"
"213","1.278118","192.168.43.6","142.250.182.206","TLSv1.3","1528","Application Data"
"214","0.805576","192.168.43.6","223.196.57.16","TCP","74","53450  >  443 [SYN] Seq=0 Win=64240 Len=0 MSS=1460 SACK_PERM=1 TSval=4115027597 TSecr=0 WS=128"
"215","1.698058","192.168.43.6","223.196.57.16","TCP","74","53452  >  443 [SYN] Seq=0 Win=64240 Len=0 MSS=1460 SACK_PERM=1 TSval=4115027597 TSecr=0 WS=128"
"216","1.887124","142.250.182.206","192.168.43.6","TCP","74","443  >  50584 [SYN, ACK] Seq=0 Ack=1 Win=65535 Len=0 MSS=1360 SACK_PERM=1 TSval=1771726803 TSecr=2646002453 WS=256"
"217","1.338658","192.168.43.6","142.250.182.206","TCP","66","50584  >  443 [ACK] Seq=1 Ack=1 Win=64256 Len=0 TSval=2646002558 TSecr=1771726803"
"218","1.891168","192.168.43.6","142.250.182.206","TLSv1.3","888","Client Hello"
"219","1.1360190","223.196.57.16","192.168.43.6","TCP","74","443  >  53450 [SYN, ACK] Seq=0 Ack=1 Win=65535 Len=0 MSS=1360 SACK_PERM=1 TSval=1070632947 TSecr=4115027597 WS=256"
"220","1.1360981","192.168.43.6","223.196.57.16","TCP","66","53450  >  443 [ACK] Seq=1 Ack=1 Win=64256 Len=0 TSval=4115027663 TSecr=1070632947"
"221","1.386198","192.168.43.6","223.196.57.16","TLSv1.3","583","Client Hello"
"222","0.859702","223.196.57.16","192.168.43.6","TCP","74","443  >  53452 [SYN, ACK] Seq=0 Ack=1 Win=65535 Len=0 MSS=1360 SACK_PERM=1 TSval=1070632948 TSecr=4115027597 WS=256"
"223","1.1438040","192.168.43.6","223.196.57.16","TCP","66","53452  >  443 [ACK] Seq=1 Ack=1 Win=64256 Len=0 TSval=4115027671 TSecr=1070632948"
"224","1.1438431","142.250.182.206","192.168.43.6","TCP","66","443  >  50582 [ACK] Seq=188 Ack=829 Win=68608 Len=0 TSval=1093286724 TSecr=2646002495"
"225","1.1438884","142.250.182.206","192.168.43.6","TCP","66","443  >  50582 [ACK] Seq=188 Ack=903 Win=68608 Len=0 TSval=1093286725 TSecr=2646002495"
"226","1.1441471","192.168.43.6","223.196.57.16","TLSv1.3","583","Client Hello"
"227","1.1689825","142.250.182.206","192.168.43.6","TCP","66","443  >  50582 [ACK] Seq=188 Ack=2251 Win=71424 Len=0 TSval=1093286761 TSecr=2646002497"
"228","1.1690611","142.250.182.206","192.168.43.6","TCP","66","443  >  50582 [ACK] Seq=188 Ack=2365 Win=71424 Len=0 TSval=1093286762 TSecr=2646002497"
"229","1.1793124","142.250.182.206","192.168.43.6","TCP","66","443  >  50584 [ACK] Seq=1 Ack=823 Win=68608 Len=0 TSval=1771726894 TSecr=2646002558"
"230","0.866942","223.196.57.16","192.168.43.6","TCP","66","443  >  53450 [ACK] Seq=1 Ack=518 Win=66816 Len=0 TSval=1070633020 TSecr=4115027663"
"231","-0.1125083","223.196.57.16","192.168.43.6","TLSv1.3","4110","Server Hello, Change Cipher Spec"
"232","-0.1077912","192.168.43.6","223.196.57.16","TCP","66","53450  >  443 [ACK] Seq=518 Ack=4045 Win=60288 Len=0 TSval=4115027744 TSecr=1070633021"
"233","-0.1077233","192.168.43.6","223.196.57.16","TLSv1.3","72","Change Cipher Spec"
"234","-0.1076336","223.196.57.16","192.168.43.6","TLSv1.3","974","Application Data"
"235","1.472716","223.196.57.16","192.168.43.6","TCP","66","443  >  53452 [ACK] Seq=1 Ack=518 Win=66816 Len=0 TSval=1070633036 TSecr=4115027671"
"236","1.472822","223.196.57.16","192.168.43.6","TLSv1.3","1414","Server Hello, Change Cipher Spec"
"237","-0.1047287","192.168.43.6","223.196.57.16","TCP","66","53450  >  443 [ACK] Seq=524 Ack=4953 Win=63104 Len=0 TSval=4115027746 TSecr=1070633021"
"238","-0.1046403","192.168.43.6","223.196.57.16","TCP","66","53452  >  443 [ACK] Seq=518 Ack=1349 Win=63104 Len=0 TSval=4115027746 TSecr=1070633037"
"239","1.474751","192.168.43.6","223.196.57.16","TLSv1.3","72","Change Cipher Spec"
"240","-0.1044583","192.168.43.6","223.196.57.16","TLSv1.3","140","Application Data"
"241","1.475049","192.168.43.6","223.196.57.16","TLSv1.3","1491","Application Data"
"242","-0.841544","223.196.57.16","192.168.43.6","TLSv1.3","3670","Application Data"
"243","-0.809326","192.168.43.6","223.196.57.16","TCP","66","53452  >  443 [ACK] Seq=524 Ack=4953 Win=59520 Len=0 TSval=4115027772 TSecr=1070633037"
"244","-0.808747","142.250.182.206","192.168.43.6","TLSv1.3","253","Server Hello, Change Cipher Spec, Application Data"
"245","-0.806594","192.168.43.6","142.250.182.206","TCP","66","50584  >  443 [ACK] Seq=823 Ack=188 Win=64128 Len=0 TSval=2646002714 TSecr=1771726954"
"246","-0.805712","192.168.43.6","142.250.182.206","TLSv1.3","72","Change Cipher Spec"
"247","-0.804508","192.168.43.6","142.250.182.206","TLSv1.3","140","Application Data"
"248","-0.802355","192.168.43.6","223.196.57.16","TLSv1.3","140","Application Data"
"249","-0.800293","192.168.43.6","142.250.182.206","TLSv1.3","2276","Application Data"
"250","-0.781284","192.168.43.6","223.196.57.16","TLSv1.3","1447","Application Data"
"251","1.542245","223.196.57.16","192.168.43.6","TCP","66","443  >  53450 [ACK] Seq=4953 Ack=524 Win=66816 Len=0 TSval=1070633086 TSecr=4115027744"
"252","-0.368705","142.250.182.206","192.168.43.6","TLSv1.3","2103","Application Data, Application Data"
"253","1.544360","223.196.57.16","192.168.43.6","TCP","66","443  >  53450 [ACK] Seq=4953 Ack=598 Win=66816 Len=0 TSval=1070633098 TSecr=4115027747"
"254","-0.349171","142.250.182.206","192.168.43.6","TLSv1.3","1904","Application Data, Application Data"
"255","1.546158","142.250.182.206","192.168.43.6","TLSv1.3","182","Application Data"
"256","-0.329209","142.250.182.206","192.168.43.6","TLSv1.3","93","Application Data"
"257","1.546592","223.196.57.16","192.168.43.6","TCP","66","443  >  53452 [ACK] Seq=4953 Ack=524 Win=66816 Len=0 TSval=1070633103 TSecr=4115027746"
"258","1.546660","192.168.43.6","142.250.182.206","TCP","66","50582  >  443 [ACK] Seq=2365 Ack=2225 Win=62208 Len=0 TSval=2646002761 TSecr=1093286851"
"259","-0.326197","192.168.43.6","142.250.182.206","TCP","66","50582  >  443 [ACK] Seq=2365 Ack=4063 Win=60416 Len=0 TSval=2646002761 TSecr=1093286851"
"260","1.546776","192.168.43.6","142.250.182.206","TCP","66","50582  >  443 [ACK] Seq=2365 Ack=4179 Win=60416 Len=0 TSval=2646002761 TSecr=1093286852"
"261","-0.324896","192.168.43.6","142.250.182.206","TCP","66","50582  >  443 [ACK] Seq=2365 Ack=4206 Win=60416 Len=0 TSval=2646002761 TSecr=1093286852"
"262","-0.241516","223.196.57.16","192.168.43.6","TCP","66","443  >  53450 [ACK] Seq=4953 Ack=1946 Win=69632 Len=0 TSval=1070633123 TSecr=4115027748"
"263","-0.237656","223.196.57.16","192.168.43.6","TCP","66","443  >  53452 [ACK] Seq=4953 Ack=598 Win=66816 Len=0 TSval=1070633124 TSecr=4115027774"
"264","-0.236929","223.196.57.16","192.168.43.6","TCP","66","443  >  53450 [ACK] Seq=4953 Ack=2023 Win=69632 Len=0 TSval=1070633123 TSecr=4115027748"
"265","-0.236318","223.196.57.16","192.168.43.6","TLSv1.3","1414","Application Data"
"266","1.557302","192.168.43.6","223.196.57.16","TCP","66","53450  >  443 [ACK] Seq=2023 Ack=6301 Win=63104 Len=0 TSval=4115027833 TSecr=1070633124"
"267","1.558447","223.196.57.16","192.168.43.6","TCP","1414","443  >  53450 [ACK] Seq=6301 Ack=2023 Win=69632 Len=1348 TSval=1070633124 TSecr=4115027748 [TCP segment of a reassembled PDU]"
"268","-0.184162","192.168.43.6","223.196.57.16","TCP","66","53450  >  443 [ACK] Seq=2023 Ack=7649 Win=63104 Len=0 TSval=4115027835 TSecr=1070633124"
"269","-0.182898","223.196.57.16","192.168.43.6","TCP","1414","443  >  53450 [ACK] Seq=7649 Ack=2023 Win=69632 Len=1348 TSval=1070633124 TSecr=4115027748 [TCP segment of a reassembled PDU]"
"270","-0.158527","223.196.57.16","192.168.43.6","TCP","1414","[TCP Previous segment not captured] 443  >  53450 [ACK] Seq=10345 Ack=2023 Win=69632 Len=1348 TSval=1070633124 TSecr=4115027748 [TCP segment of a reassembled PDU]"
"271","-0.135002","223.196.57.16","192.168.43.6","TCP","1414","[TCP Out-Of-Order] 443  >  53450 [ACK] Seq=8997 Ack=2023 Win=69632 Len=1348 TSval=1070633124 TSecr=4115027748 [TCP segment of a reassembled PDU]"
"272","-0.109015","223.196.57.16","192.168.43.6","TCP","1414","443  >  53450 [ACK] Seq=11693 Ack=2023 Win=69632 Len=1348 TSval=1070633124 TSecr=4115027748 [TCP segment of a reassembled PDU]"
"273","-0.082896","192.168.43.6","223.196.57.16","TCP","66","53450  >  443 [ACK] Seq=2023 Ack=8997 Win=63104 Len=0 TSval=4115027836 TSecr=1070633124"
"274","1.571226","192.168.43.6","223.196.57.16","TCP","78","[TCP Dup ACK 273#1] 53450  >  443 [ACK] Seq=2023 Ack=8997 Win=63104 Len=0 TSval=4115027836 TSecr=1070633124 SLE=10345 SRE=11693"
"275","-0.080307","192.168.43.6","223.196.57.16","TCP","66","53450  >  443 [ACK] Seq=2023 Ack=11693 Win=60416 Len=0 TSval=4115027836 TSecr=1070633124"
"276","-0.079553","192.168.43.6","223.196.57.16","TCP","66","53450  >  443 [ACK] Seq=2023 Ack=13041 Win=59136 Len=0 TSval=4115027836 TSecr=1070633124"
"277","-0.078767","223.196.57.16","192.168.43.6","TCP","1414","[TCP Previous segment not captured] 443  >  53450 [ACK] Seq=14389 Ack=2023 Win=69632 Len=1348 TSval=1070633127 TSecr=4115027748 [TCP segment of a reassembled PDU]"
"278","1.574016","223.196.57.16","192.168.43.6","TCP","1414","[TCP Retransmission] 443  >  53450 [ACK] Seq=13041 Ack=2023 Win=69632 Len=1348 TSval=1070633127 TSecr=4115027748"
"279","-0.027702","223.196.57.16","192.168.43.6","TCP","2762","443  >  53450 [ACK] Seq=15737 Ack=2023 Win=69632 Len=2696 TSval=1070633131 TSecr=4115027748 [TCP segment of a reassembled PDU]"
"280","1.581686","223.196.57.16","192.168.43.6","TCP","2762","443  >  53450 [ACK] Seq=18433 Ack=2023 Win=69632 Len=2696 TSval=1070633134 TSecr=4115027748 [TCP segment of a reassembled PDU]"
"281","0.067843","192.168.43.6","223.196.57.16","TCP","78","[TCP Window Update] 53450  >  443 [ACK] Seq=2023 Ack=13041 Win=63104 Len=0 TSval=4115027848 TSecr=1070633124 SLE=14389 SRE=15737"
"282","0.068637","192.168.43.6","223.196.57.16","TCP","66","53450  >  443 [ACK] Seq=2023 Ack=15737 Win=60672 Len=0 TSval=4115027848 TSecr=1070633127"
"283","0.069226","192.168.43.6","223.196.57.16","TCP","66","53450  >  443 [ACK] Seq=2023 Ack=18433 Win=57984 Len=0 TSval=4115027848 TSecr=1070633131"
"284","1.586308","192.168.43.6","223.196.57.16","TCP","66","53450  >  443 [ACK] Seq=2023 Ack=21129 Win=55296 Len=0 TSval=4115027848 TSecr=1070633134"
"285","0.070132","223.196.57.16","192.168.43.6","TCP","2762","443  >  53450 [ACK] Seq=21129 Ack=2023 Win=69632 Len=2696 TSval=1070633138 TSecr=4115027748 [TCP segment of a reassembled PDU] [TCP segment of a reassembled PDU]"
"286","0.099305","192.168.43.6","223.196.57.16","TCP","66","53450  >  443 [ACK] Seq=2023 Ack=23825 Win=61056 Len=0 TSval=4115027849 TSecr=1070633138"
"287","0.099937","223.196.57.16","192.168.43.6","TCP","2762","443  >  53450 [ACK] Seq=23825 Ack=2023 Win=69632 Len=2696 TSval=1070633141 TSecr=4115027748 [TCP segment of a reassembled PDU]"
"288","0.140287","223.196.57.16","192.168.43.6","TCP","1414","[TCP Previous segment not captured] 443  >  53450 [ACK] Seq=27869 Ack=2023 Win=69632 Len=1348 TSval=1070633144 TSecr=4115027748 [TCP segment of a reassembled PDU]"
"289","0.156068","223.196.57.16","192.168.43.6","TCP","1414","[TCP Out-Of-Order] 443  >  53450 [ACK] Seq=26521 Ack=2023 Win=69632 Len=1348 TSval=1070633144 TSecr=4115027748 [TCP segment of a reassembled PDU]"
"290","0.173637","223.196.57.16","192.168.43.6","TCP","1414","443  >  53450 [ACK] Seq=29217 Ack=2023 Win=69632 Len=1348 TSval=1070633148 TSecr=4115027748 [TCP segment of a reassembled PDU]"
"291","0.190057","192.168.43.6","223.196.57.16","TCP","66","53450  >  443 [ACK] Seq=2023 Ack=26521 Win=61056 Len=0 TSval=4115027858 TSecr=1070633141"
